{
  "type": "object",
  "additionalProperties": false,
  "properties": {
    "schemaVersion": {
      "const": 1
    },
    "datasetId": {
      "type": "string",
      "minLength": 1
    },
    "revision": {
      "type": "integer",
      "minimum": 0
    },
    "binding": {
      "$ref": "binding.schema.json"
    },
    "records": {
      "type": "array",
      "items": {
        "$ref": "record.schema.json"
      }
    },
    "operations": {
      "type": "array",
      "items": {
        "type": "object",
        "additionalProperties": false,
        "properties": {
          "operationId": {
            "type": "string",
            "minLength": 1
          },
          "requestHash": {
            "type": "string",
            "pattern": "^[a-f0-9]{64}$"
          },
          "action": {
            "enum": [
              "append",
              "correct",
              "status"
            ]
          },
          "revision": {
            "type": "integer",
            "minimum": 1
          },
          "recordIds": {
            "type": "array",
            "minItems": 1,
            "uniqueItems": true,
            "items": {
              "type": "string",
              "minLength": 1
            }
          }
        },
        "required": [
          "operationId",
          "requestHash",
          "action",
          "revision",
          "recordIds"
        ]
      }
    }
  },
  "required": [
    "schemaVersion",
    "datasetId",
    "revision",
    "binding",
    "records",
    "operations"
  ],
  "$schema": "https://json-schema.org/draft/2020-12/schema",
  "title": "Canonical portable dataset snapshot"
}
