{
  "schemaVersion": 1,
  "datasetId": "synthetic-dataset",
  "revision": 1,
  "binding": {
    "schemaVersion": 1,
    "bindingId": "synthetic-binding-001",
    "synthetic": true,
    "provider": "example-provider",
    "accountReference": "synthetic-account",
    "canonicalDatasetReference": "synthetic-dataset",
    "canonicalUrl": "https://example.invalid/synthetic-dataset",
    "nativeRecordKind": "provider-native-row",
    "dataCategories": [
      "synthetic demo measurements"
    ],
    "consent": {
      "evidenceReference": "synthetic-example-not-real-approval",
      "scope": "Only synthetic examples requested by the test user",
      "approvedAt": "2026-01-01T00:00:00Z",
      "futureUserRequestedWrites": true,
      "originalImageStorageApproved": false
    }
  },
  "records": [
    {
      "schemaVersion": 1,
      "recordId": "synthetic-record-001",
      "operationId": "synthetic-import-001",
      "synthetic": true,
      "metric": "demo_metric",
      "value": 42,
      "rawValueText": "42",
      "unit": "demo units",
      "measurementTime": {
        "rawText": "2026-01-01",
        "normalized": "2026-01-01",
        "precision": "date",
        "timezone": null,
        "confirmed": true
      },
      "status": "active",
      "deletedAt": null,
      "sourceReference": null,
      "providerRecordReference": null
    },
    {
      "schemaVersion": 1,
      "recordId": "synthetic-record-002",
      "operationId": "synthetic-import-001",
      "synthetic": true,
      "metric": "demo_metric",
      "value": 45,
      "rawValueText": "45",
      "unit": "demo units",
      "measurementTime": {
        "rawText": "2026-01-02",
        "normalized": "2026-01-02",
        "precision": "date",
        "timezone": null,
        "confirmed": true
      },
      "status": "active",
      "deletedAt": null,
      "sourceReference": null,
      "providerRecordReference": null
    },
    {
      "schemaVersion": 1,
      "recordId": "synthetic-record-003",
      "operationId": "synthetic-import-001",
      "synthetic": true,
      "metric": "demo_metric",
      "value": 43,
      "rawValueText": "43",
      "unit": "demo units",
      "measurementTime": {
        "rawText": "2026-01-03",
        "normalized": "2026-01-03",
        "precision": "date",
        "timezone": null,
        "confirmed": true
      },
      "status": "active",
      "deletedAt": null,
      "sourceReference": null,
      "providerRecordReference": null
    }
  ],
  "operations": [
    {
      "operationId": "synthetic-import-001",
      "requestHash": "d5f173db5c875dc1b02c3b00f13c5b43756d4d84377e3ff2ce37a7a7e03aabd8",
      "action": "append",
      "revision": 1,
      "recordIds": [
        "synthetic-record-001",
        "synthetic-record-002",
        "synthetic-record-003"
      ]
    }
  ]
}
